{
  "skill": "relationship-graph",
  "version": "0.1.0",
  "mode": "summarize_network",
  "profile_store_path": "D:/Lenny_Bcontext/skill-system/relationship-ingestion/incremental-scenarios/2026-04-13-jf-weather-agent/relationship-profile-store.incremental-2026-04-13-jf-weather-agent.json",
  "options": {
    "save_run_artifacts": true,
    "max_nodes": 20,
    "max_edges": 40,
    "min_relation_score": 2
  }
}
