{
  "skill": "relationship-graph",
  "version": "0.1.0",
  "mode": "get_person_graph",
  "profile_store_path": "relationship-profile-store.example.json",
  "person_name": "Jordan Li",
  "options": {
    "save_run_artifacts": true,
    "max_nodes": 12,
    "max_edges": 20,
    "min_relation_score": 2
  }
}
