{
  "skill": "relationship-graph",
  "version": "0.1.0",
  "mode": "get_person_graph",
  "profile_store_path": "D:/Lenny_Bcontext/skill-system/relationship-ingestion/incremental-scenarios/2026-04-13-jf-weather-agent/relationship-profile-store.incremental-2026-04-13-jf-weather-agent.json",
  "person_name": "剑锋",
  "options": {
    "save_run_artifacts": true,
    "max_nodes": 12,
    "max_edges": 20,
    "min_relation_score": 2
  }
}
